<?xml version="1.0"?>
<!DOCTYPE techspec PUBLIC "" "./techspec.dtd">
<techspec>
    <!--  Relationships and roles. Role id values must be unique.   -->

    <relationship relationship_id="CPY_C2_Relationship" name="CPE CPY C2 Relationship">
        <roleinfo role_id="CPYSuperior" cardinality="1"></roleinfo>
        <roleinfo role_id="CPYEntity" cardinality="N"></roleinfo>
    </relationship>

    <relationship relationship_id="BN_C2_Relationship" name="CPE CPY C2 Relationship">
        <roleinfo role_id="BNSuperior" cardinality="1"></roleinfo>
        <roleinfo role_id="BNEntity" cardinality="N"></roleinfo>
    </relationship>

    <relationship relationship_id="CPESupplyRelationship" name="CPE Supply Relationship">
        <roleinfo role_id="CPESupplier" cardinality="N"></roleinfo>
        <roleinfo role_id="CPECustomer" cardinality="N"></roleinfo>
    </relationship>

    <relationship relationship_id="BDEEntity" name="BDE Self">
        <roleinfo role_id="BDEEntity" cardinality="1"></roleinfo>
    </relationship>


    <!--    <relationship relationship_id="BN_C2_Relationship" name="CPE BN C2 Relationship">-->
    <!--        <roleinfo role_id="CPYSuperior" cardinality="1"></roleinfo>-->
    <!--        <roleinfo role_id="CPYSubordinate" cardinality="N"></roleinfo>-->
    <!--    </relationship>-->

    <!-- Notes: Although the state machines presented have multiple states (Start/Configured/Running), from a modelling-->
    <!-- perspective, we need to only consider the simple case, the running state.  This allows one plugin to play multiple   -->
    <!-- roles by making all the running states equivalent.-->

    <!--    Company Entity Role-->
    <rolespec role_id="CPYEntity">
        <states>
            <state state_id="Start"></state>
            <state state_id="Configured"></state>
            <state state_id="Running"></state>
            <state state_id="Stopped"></state>
        </states>
        <actions>
            <action action_name="ConfigureAction" method_name="DoConfigureAction" from_state="Start" to_state="Configured">
                <action_input>
                    <message_spec classname="org.cougaar.cpe.agents.messages.ConfigureMessage"></message_spec>
                </action_input>
            </action>
            <action action_name="StartAction" method_name="DoStartAction" from_state="Start" to_state="Running">
                <action_input>
                    <message_spec classname="org.cougaar.cpe.agents.messages.StartMessage"></message_spec>
                </action_input>
                <action_outputs>
                    <timer_action type="Start" timer_id="UpdateWorldStatusTimer"></timer_action>
                </action_outputs>
            </action>
            <action action_name="UpdateWorldStatusAction" method_name="DoUpdateWorldStatusAction" from_state="Running" to_state="Running">
                <action_input>
                    <timer_event_spec timer_id="UpdateWorldStatusTimer"></timer_event_spec>
                </action_input>
                <action_outputs>
                    <message_action dest_role_id="CPYSuperior" type="exactly_one">
                        <message_spec classname="org.cougaar.cpe.agents.messages.WorldStateUpdateMessage"></message_spec>
                    </message_action>
                </action_outputs>
            </action>
        </actions>
        <timers>
            <timer_spec timer_id="UpdateWorldStatusTimer" periodic="True"></timer_spec>
        </timers>
    </rolespec>

    <rolespec role_id="CPYSuperior">
        <states>
            <state state_id="Start"></state>
            <state state_id="Configured"></state>
            <state state_id="Running"></state>
            <state state_id="Stopped"></state>
        </states>
        <actions>
            <action action_name="ConfigureAction" method_name="DoConfigureAction" from_state="Start" to_state="Configured">
                <action_input>
                    <message_spec classname="org.cougaar.cpe.agents.messages.ConfigureMessage"></message_spec>
                </action_input>
            </action>
            <action action_name="StartAction" method_name="DoStartAction" from_state="Start" to_state="Running">
                <action_input>
                    <message_spec classname="org.cougaar.cpe.agents.messages.StartMessage"></message_spec>
                </action_input>
                <action_outputs>
                    <timer_action type="Start" timer_id="UpdateWorldStatusTimer"></timer_action>
                </action_outputs>
            </action>
            <action action_name="PlanManuever" method_name="DoPlanAction" from_state="Running" to_state="Running">
                <action_input>
                    <timer_event_spec timer_id="ReplanTimer"></timer_event_spec>
                </action_input>
                <action_outputs>
                    <message_action dest_role_id="CPYSubordinate" type="one_to_each">
                        <message_spec classname="org.cougaar.cpe.agents.messages.ManueverPlanMessage"></message_spec>
                    </message_action>
                </action_outputs>
            </action>
        </actions>
        <timers>
            <timer_spec timer_id="ReplanTimer" periodic="True"></timer_spec>
        </timers>
    </rolespec>

    <!--    This is the BN role to implemented by all BN plugins.-->
    <rolespec role_id="BNEntity">
        <states>
            <state state_id="Start"></state>
            <state state_id="Configured"></state>
            <state state_id="Running"></state>
            <state state_id="Stopped"></state>
        </states>
        <actions>
            <action action_name="ConfigureAction" method_name="DoConfigureAction" from_state="Start" to_state="Configured">
                <action_input>
                    <message_spec classname="org.cougaar.cpe.agents.messages.ConfigureMessage"></message_spec>
                </action_input>
            </action>
            <action action_name="StartAction" method_name="DoStartAction" from_state="Start" to_state="Running">
                <action_input>
                    <message_spec classname="org.cougaar.cpe.agents.messages.StartMessage"></message_spec>
                </action_input>
                <action_outputs>
                    <timer_action type="Start" timer_id="UpdateWorldStatusTimer"></timer_action>
                </action_outputs>
            </action>
            <action action_name="UpdateWorldState" method_name="DoUpdateWorldStatusAction" from_state="Running" to_state="Running">
                <action_input>
                    <timer_event_spec timer_id="UpdateWorldStatusTimer"></timer_event_spec>
                </action_input>
                <action_outputs>
                    <message_action dest_role_id="BNSuperior" type="exactly_one">
                        <message_spec classname="org.cougaar.cpe.agents.messages.WorldStateUpdateMessage"></message_spec>
                    </message_action>
                </action_outputs>
            </action>
        </actions>
        <timers>
            <timer_spec timer_id="UpdateWorldStatusTimer" periodic="True"></timer_spec>
        </timers>
    </rolespec>

    <!--    This corresponds to BDE agents and any other agents which can directly control the BN agents.-->
    <rolespec role_id="BNSuperior">
        <states>
            <state state_id="Start"></state>
            <state state_id="Configured"></state>
            <state state_id="Running"></state>
            <state state_id="Stopped"></state>
        </states>
        <actions>
            <action action_name="ConfigureAction" method_name="DoConfigureAction" from_state="Start" to_state="Configured">
                <action_input>
                    <message_spec classname="org.cougaar.cpe.agents.messages.ConfigureMessage"></message_spec>
                </action_input>
            </action>
            <action action_name="StartAction" method_name="DoStartAction" from_state="Start" to_state="Running">
                <action_input>
                    <message_spec classname="org.cougaar.cpe.agents.messages.StartMessage"></message_spec>
                </action_input>
                <action_outputs>
                    <timer_action type="Start" timer_id="UpdateWorldStatusTimer"></timer_action>
                </action_outputs>
            </action>
            <action action_name="ProcessReplanTimer" method_name="DoProcessReplanTimer" from_state="Running" to_state="Running">
                <action_input>
                    <timer_event_spec timer_id="ReplanTimer"></timer_event_spec>
                </action_input>
            </action>
            <action action_name="ProcessUpdateMessage" method_name="processWorldStateUpdateMessage" from_state="Running" to_state="Running">
                <action_input>
                    <message_spec classname="org.cougaar.cpe.agents.messages.UnitStatusUpdateMessage"></message_spec>
                </action_input>
            </action>
        </actions>
        <timers>
            <timer_spec timer_id="ReplanTimer" periodic="True"></timer_spec>
        </timers>
    </rolespec>

    <!--***************************************************-->
    <!--  PLUGIN DEFINITIONS                               -->
    <!--    These plugins implement the role defined above.-->

    <plugin_spec>
        <component_name>
            CPYAgentPlugin
        </component_name>
        <class_name>
            org.cougaar.cpe.agents.plugin.UnitAgentPlugin
        </class_name>
        <role_impl_spec role_id="CPYEntity">
            <operating_modes>
                <operating_mode operating_mode_id="WorldStateUpdatePeriod">
                    <omcrangelist>
                        <omcpoint value="10000"></omcpoint><omcpoint value="15000"></omcpoint>
                        <omcpoint value="20000"></omcpoint><omcpoint value="25000"></omcpoint>